name,old_price,new_price
Pringles Potato Crisps 118g-134g,5.5,2.75
KB's Salt and Pepper Squid 360g or Whiting Bites 300g,10.5,5.25
Zooper Dooper Water Ice 24 Pack,7.0,3.5
Nivea Sun Protect & Moisture Sunscreen SPF50+ 300mL-400mL^,26.0,13.0
Cancer Council Kids or Ultra Sunscreen SPF50+ 250mL^,21.0,10.5
Bondi Sands Wet Skin Sport Sunscreen SPF50 125mL^,18.0,9.0
Nescafé Coffee Sachets 8 Pack-10 Pack,7.6,3.8
Dynamo Professional Laundry Liquid 2 Litre,29.0,14.5
Cheezels 125g,3.25,1.62
"Pepsi, Solo or Schweppes Soft Drink or Schweppes Sparkling Water 10x375mL",16.5,8.25
"Coca-Cola, Fanta or Sprite Soft Drink 12x300mL",19.0,9.5
Banana Boat Pure Aloe Vera Gel 250g,9.5,4.75
Banana Boat Sport Sunscreen Pump SPF50+ 400g,28.0,14.0
Ocean Australia 100% Natural Body Sunscreen SPF50+ 120g,25.0,12.5
Bondi Sands Sunny Daze SPF50 Moisturiser 50g,23.0,11.5
Dermaveen Sensitive Sun Sunscreen SPF50+ 100g,17.0,8.5
Cancer Council Invisible Day Wear Facial Sunscreen SPF50+ 150mL,21.0,10.5
Cancer Council Mens Hydrating Sunscreen SPF50+ 100mL,17.5,8.75
Bondi Sands Fragrance Free Face Sunscreen SPF50+ 75mL,15.0,7.5
Quick Screen Sunscreen Spray SPF50+ 90mL,40.0,20.0
Sun Genius Hydrating Sunscreen SPF50+ 400mL,25.0,12.5
Neutrogena Ultra Sheer Sunscreen SPF50 88mL,20.0,10.0
Reef Coconut Sunscreen Oil SPF15 125mL,14.0,7.0
Hismile V34 Colour Corrector Teeth Whitening Serum 30mL,35.0,17.5
Pantene Shampoo or Conditioner 900mL,20.0,10.0
Epzen Body Wash 750mL,17.0,8.5
Twenty4 Body Mist 200mL,12.0,6.0
Colgate Sensitive Pro Relief Toothpaste 110g,11.0,5.5
Colgate Total Advanced Whitening & Tartar or Max Fresh Toothpaste 115g,6.5,3.25
Hismile Toothpaste Watermelon or Mango 60g,13.0,6.5
Colgate Toothbrush 360 Degree Toothbrush 1 Pack,5.0,2.5
Colgate Total Mouthwash 500mL,10.0,5.0
Nature's Way Adult Vita Gummies Multivitamin 120 Pack or Hair Skin Nails 60 Pack^,24.0,12.0
Nature's Way Beauty Collagen 120 Pack or Restore Probiotic Daily Health 90 Pack^,50.0,25.0
Nature's Way High Strength Magnesium 150 Pack^,24.0,12.0
Nature's Way Vitamin C 500mg Sugarless Chewable Tablets 500 Pack^,29.0,14.5
Nature's Way Glucosamine 1500mg Tablets 200 Pack^,40.0,20.0
Blackmores Probiotics+ Daily Health 30 Pack^,33.0,16.5
Glow Lab Shampoo or Conditioner 600mL,33.0,16.5
Toni & Guy Shampoo or Conditioner 250mL,19.0,9.5
Provoke Touch Of Silver Maintenance Shampoo or Conditioner 400mL,10.0,5.0
Veet Expert Hair Removal Wax Strips For Legs & Body 20 Pack,11.5,5.75
Biozet Attack Regular Laundry Liquid 2 Litre or Powder 2kg,24.0,12.0
Radiant Laundry Liquid 1 Litre or Powder 1kg,11.0,5.5
Morning Fresh Dishwashing Liquid 400mL,5.5,2.75
Finish Rinse and Shine Aid 500mL,11.5,5.75
Harpic Power Plus 700mL,10.0,5.0
Bref Toilet Rim Block Twin Pack 2x50g,11.0,5.5
Aerogard Body Insect Repellent 150g,12.0,6.0
Downy Unstopables In-Wash Scent Booster Beads 422g,31.0,15.5
Fluffy Concentrated Fabric Conditioner 900mL-1 Litre,9.0,4.5
Tip Top English Muffins 6 Pack,6.0,3.0
Mars Chocolate Bar 35g-56g,2.2,1.1
Lindt Cornet 327g-333g,26.0,13.0
Urban Cookie Co. Indulgent Cookies 200g,5.5,2.75
CC’s Corn Chips 175g or Cornados 110g,4.7,2.35
Majans Bhuja Mix 140g-160g,4.5,2.25
Table of Plenty Grazing Poppers 60g,4.5,2.25
V8 Juice 1.25 Litre,5.5,2.75
Raw C Coconut Water 1 Litre,5.5,2.75
Jarrah Latte 250g,7.5,3.75
Vittoria Freeze Dried Instant Coffee 400g,36.0,18.0
Heritage Mill Muesli or Clusters 750g,6.8,3.4
Vege Chips 100g or Rice Crackers 75g,4.9,2.45
Naturopathica Fat Blaster Weight Loss Shake 465g,28.0,14.0
Bob Snail Fruit Rolls 60g,4.5,2.25
Vittoria Coffee Bags 20 Pack,12.5,6.25
Sunrice Jasmine Rice 5kg,24.0,12.0
Gold Sunset Canola or Vegetable Oil 4 Litre,36.0,18.0
Continental Recipe Base 30g-50g,1.8,0.9
Praise Whole Egg Mayonnaise 335g-380g,5.5,2.75
La Española Grapeseed Oil 1 Litre,16.0,8.0
Weis 4 Pack 280mL,9.5,4.75
Creative Gourmet Frozen Fruits 300g-500g,5.0,2.5
Dairy Farmers Thick & Creamy Yoghurt 140g-150g,2.6,1.3
Bosisto's Body Wash Pump 1 Litre,16.0,8.0
Bosistos Hand Wash Refill 1 Litre,15.0,7.5
Brut Human 72Hr Antiperspirant Aerosol Deodorant 130g,9.0,4.5
Brut 72Hr Antiperspirant Aerosol Deodorant 130g,8.5,4.25
Mortein NaturGard Multi-Insect Automatic Spray Refill 152g,20.0,10.0
Mortein PowerGard Multi-Insect Automatic Spray Refill 154g,20.0,10.0
Finish Ultimate Pro All In 1 Dishwashing Tablets 32 Pack,44.0,22.0
Downy Concentrate Fabric Conditioner 800mL-900mL,13.0,6.5
Dynamo Professional Laundry Discs 28 Pack,32.0,16.0
Smash Fashion Tritan Bottle 700mL,9.0,4.5
Duracell Coppertop Batteries AAA 20 Pack or AA 24 Pack,29.0,14.5
Telstra Lite 3,59.0,29.0
Vodafone $50 Prepaid Plus Starter Pack,50.0,20.0
Lebara $24.90 Starter Pack,24.9,6.0
